{
  "$schema": "https://json-schema.org/draft/2020-12/schema",
  "$id": "https://schemas.primusspark.com/portal/research-retained-analytics.v2.schema.json",
  "title": "ResearchRetainedAnalyticsV2",
  "description": "D-AN-01 source-time all-time OOS descriptive analytics. v1 remains readable. No rolling detailed-screen metrics or reconstructed PnL/fills/objectives.",
  "type": "object",
  "additionalProperties": false,
  "required": ["schema_version", "input_digest", "scope_locator", "benchmark_locator", "oos_observation_count", "drawdown_recovered", "metrics", "behaviour", "strategy_curve", "benchmark_curve", "last_30d"],
  "properties": {
    "schema_version": {"const": "research.retained-analytics.v2"},
    "input_digest": {"$ref": "#/$defs/Digest"},
    "scope_locator": {"$ref": "#/$defs/Locator"},
    "benchmark_locator": {"$ref": "#/$defs/Locator"},
    "oos_observation_count": {"$ref": "#/$defs/PositiveCount"},
    "drawdown_recovered": {"type": "boolean"},
    "metrics": {
      "type": "object", "additionalProperties": false,
      "required": ["sharpe", "sortino", "cagr_fraction", "profit_factor", "long_hit_rate_fraction", "short_hit_rate_fraction", "volatility_fraction", "skew", "excess_kurtosis", "beta", "correlation", "benchmark_return_fraction", "max_drawdown_duration_days", "sharpe_decay"],
      "properties": {
        "sharpe": {"$ref": "#/$defs/Fact"},
        "sortino": {"$ref": "#/$defs/Fact"},
        "cagr_fraction": {"$ref": "#/$defs/Fact"},
        "profit_factor": {"$ref": "#/$defs/Fact"},
        "long_hit_rate_fraction": {"$ref": "#/$defs/Fact"},
        "short_hit_rate_fraction": {"$ref": "#/$defs/Fact"},
        "volatility_fraction": {"$ref": "#/$defs/Fact"},
        "skew": {"$ref": "#/$defs/Fact"},
        "excess_kurtosis": {"$ref": "#/$defs/Fact"},
        "beta": {"$ref": "#/$defs/Fact"},
        "correlation": {"$ref": "#/$defs/Fact"},
        "benchmark_return_fraction": {"$ref": "#/$defs/Fact"},
        "max_drawdown_duration_days": {"$ref": "#/$defs/Fact"},
        "sharpe_decay": {"$ref": "#/$defs/Fact"}
      }
    },
    "behaviour": {
      "type": "object", "additionalProperties": false,
      "required": ["exposure_long_fraction", "exposure_short_fraction", "exposure_flat_fraction", "win_rate", "payoff_ratio", "average_hold_seconds", "max_consecutive_losses", "turnover_notional"],
      "properties": {
        "exposure_long_fraction": {"$ref": "#/$defs/Fact"},
        "exposure_short_fraction": {"$ref": "#/$defs/Fact"},
        "exposure_flat_fraction": {"$ref": "#/$defs/Fact"},
        "win_rate": {"$ref": "#/$defs/Fact"},
        "payoff_ratio": {"$ref": "#/$defs/Fact"},
        "average_hold_seconds": {"$ref": "#/$defs/Fact"},
        "max_consecutive_losses": {"$ref": "#/$defs/Fact"},
        "turnover_notional": {"$ref": "#/$defs/Fact"}
      }
    },
    "strategy_curve": {"$ref": "#/$defs/Curve"},
    "benchmark_curve": {"$ref": "#/$defs/Curve"},
    "distributions": {"$ref": "#/$defs/Distributions"},
    "last_30d": {
      "type": "object", "additionalProperties": false,
      "required": ["label", "window_start_utc_ms", "window_end_utc_ms", "partial_window", "source_observation_count", "points", "return_fraction", "sharpe"],
      "properties": {
        "label": {"const": "last 30D"},
        "window_start_utc_ms": {"$ref": "#/$defs/UtcMs"},
        "window_end_utc_ms": {"$ref": "#/$defs/UtcMs"},
        "partial_window": {"type": "boolean"},
        "source_observation_count": {"$ref": "#/$defs/Count"},
        "points": {"$ref": "#/$defs/Curve"},
        "return_fraction": {"$ref": "#/$defs/Fact"},
        "sharpe": {"$ref": "#/$defs/Fact"}
      }
    }
  },
  "$defs": {
    "MonthlyPoint": {
      "type": "object", "additionalProperties": false,
      "required": ["month_start_utc_ms", "return_fraction", "partial", "observation_count", "basis", "base_at_utc_ms", "close_at_utc_ms"],
      "properties": {
        "month_start_utc_ms": {"$ref": "#/$defs/UtcMs"}, "return_fraction": {"$ref": "#/$defs/Decimal"},
        "partial": {"type": "boolean"}, "observation_count": {"$ref": "#/$defs/PositiveCount"},
        "basis": {"enum": ["FIRST_OOS_CLOSE", "FIRST_FULL_SAMPLE_CLOSE", "PREVIOUS_OBSERVED_MONTH_CLOSE"]},
        "base_at_utc_ms": {"$ref": "#/$defs/UtcMs"}, "close_at_utc_ms": {"$ref": "#/$defs/UtcMs"}
      }
    },
    "DistributionBucket": {"type":"object","additionalProperties":false,"required":["lower_inclusive","upper","upper_inclusive","count"],"properties":{"lower_inclusive":{"$ref":"#/$defs/Decimal"},"upper":{"$ref":"#/$defs/Decimal"},"upper_inclusive":{"enum":["true","false"]},"count":{"type":"string","pattern":"^[0-9]+$","maxLength":7}}},
    "Distributions": {
      "title": "ResearchAllTimeDistributions", "type": "object", "additionalProperties": false,
      "description": "Additive precomputed OOS companion, including a partial leading month. Daily histogram is all-time, not a trade or per-bar histogram. Original seals remain immutable.",
      "required": ["schema_version","origin","scope","scope_locator","input_digest","oos_observation_count","monthly_definition","distribution_definition","monthly_returns","return_distribution"],
      "properties": {
        "schema_version":{"const":"research.all-time-distributions.v1"},"origin":{"const":"PORTAL_DERIVED"},"scope":{"enum":["OOS","FULL_SAMPLE"]},
        "scope_locator":{"$ref":"#/$defs/Locator"},"input_digest":{"$ref":"#/$defs/Digest"},"oos_observation_count":{"type":"integer","minimum":2,"maximum":2000000},
        "monthly_definition":{"enum":["OOS_MONTH_CLOSE_OVER_FIRST_OOS_OR_PREVIOUS_OBSERVED_MONTH_CLOSE_V1","FULL_SAMPLE_MONTH_CLOSE_OVER_FIRST_OR_PREVIOUS_OBSERVED_MONTH_CLOSE_V1"]},
        "distribution_definition":{"const":"ALL_TIME_SOURCE_UTC_DAILY_RETURNS_12_BIN_V1"},
        "monthly_returns":{"type":"object","additionalProperties":false,"required":["state","reason_code","source_observation_count","emitted_point_count","total_period_count","omitted_leading_period_count","omitted_transport_period_count","sampling","values"],"properties":{"state":{"enum":["AVAILABLE","NOT_APPLICABLE"]},"reason_code":{"anyOf":[{"$ref":"#/$defs/Reason"},{"type":"null"}]},"source_observation_count":{"$ref":"#/$defs/Count"},"emitted_point_count":{"type":"integer","minimum":0,"maximum":32},"total_period_count":{"$ref":"#/$defs/Count"},"omitted_leading_period_count":{"$ref":"#/$defs/Count"},"omitted_transport_period_count":{"$ref":"#/$defs/Count"},"sampling":{"enum":["FULL","TAIL_WINDOW_V1"]},"values":{"type":"array","maxItems":32,"items":{"$ref":"#/$defs/MonthlyPoint"}}}},
        "return_distribution":{"type":"object","additionalProperties":false,"required":["state","reason_code","source_observation_count","emitted_point_count","sampling","values"],"properties":{"state":{"enum":["AVAILABLE","NOT_APPLICABLE"]},"reason_code":{"anyOf":[{"$ref":"#/$defs/Reason"},{"type":"null"}]},"source_observation_count":{"$ref":"#/$defs/Count"},"emitted_point_count":{"type":"integer","minimum":0,"maximum":12},"sampling":{"enum":["FULL_RETURN_HISTOGRAM_V2","NOT_APPLICABLE"]},"values":{"type":"array","maxItems":12,"items":{"$ref":"#/$defs/DistributionBucket"}}}}
      }
    },
    "Decimal": {"type": "string", "pattern": "^-?(?:0|[1-9][0-9]*)(?:\\.[0-9]+)?$", "maxLength": 96},
    "Digest": {"type": "string", "pattern": "^[0-9a-f]{64}$"},
    "UtcMs": {"type": "integer", "minimum": 0, "maximum": 9007199254740991},
    "Count": {"type": "integer", "minimum": 0, "maximum": 2000000},
    "PositiveCount": {"type": "integer", "minimum": 1, "maximum": 2000000},
    "Locator": {"type": "string", "minLength": 1, "maxLength": 256},
    "Reason": {"type": "string", "pattern": "^[A-Z][A-Z0-9_]{2,159}$"},
    "Fact": {
      "type": "object", "additionalProperties": false,
      "required": ["state", "reason_code", "value", "origin", "scope", "source_locator", "input_digest"],
      "properties": {
        "state": {"enum": ["AVAILABLE", "NOT_PUBLISHED", "NOT_APPLICABLE"]},
        "reason_code": {"anyOf": [{"$ref": "#/$defs/Reason"}, {"type": "null"}]},
        "value": {"anyOf": [{"$ref": "#/$defs/Decimal"}, {"type": "null"}]},
        "origin": {"enum": ["ENGINE_DIRECT", "PORTAL_DERIVED"]},
        "scope": {"enum": ["OOS", "FULL_SAMPLE"]},
        "source_locator": {"$ref": "#/$defs/Locator"},
        "input_digest": {"$ref": "#/$defs/Digest"}
      },
      "allOf": [{"if": {"properties": {"state": {"const": "AVAILABLE"}}}, "then": {"properties": {"value": {"$ref": "#/$defs/Decimal"}, "reason_code": {"type": "null"}}}, "else": {"properties": {"value": {"type": "null"}, "reason_code": {"$ref": "#/$defs/Reason"}}}}]
    },
    "Curve": {"type": "array", "maxItems": 24, "items": {"type": "object", "additionalProperties": false, "required": ["at_utc_ms", "value"], "properties": {"at_utc_ms": {"$ref": "#/$defs/UtcMs"}, "value": {"$ref": "#/$defs/Decimal"}}}}
  }
}
